Authors,Title,Year,Link,Abstract,Author Keywords
"Jeon S., Thajudeen T., Hogan C.J.",Evaluation of nanoparticle aggregate morphology during wet milling,2015,https://www.scopus.com/inward/record.uri?eid=2-s2.0-84916602150&doi=10.1016%2fj.powtec.2014.11.039&partnerID=40&md5=25ee3e1e086a673c48eb66207ee9b613,"Recently developed wet mills (bead mills) have been shown capable of dispersing nanoparticle aggregates into primary particles in suspension, even with nanoparticles with primary particle radii as small as 5. nm and at high nanoparticle volume fractions (>. 1%). However, to date what has not been examined is the change in aggregate morphology during milling itself, i.e. it is not clear if wet milling simply fragments aggregates into smaller, similarly structured entities, or if milling can simultaneously lead to aggregate restructuring. Here we develop and apply methods to examine the change in morphology in titania and alumina nanoparticle aggregates (primary particle radii of ~. 8.25. nm and 7.20. nm, respectively) during wet milling with a Kotobuki Industries UAM-015 wet mill. Specifically, via nanoparticle tracking analysis (NTA) with a Nanosight LM-14 and simultaneous viscosity measurements, we characterized the hydrodynamic radius distribution functions and average intrinsic viscosities of both titania and alumina aggregates milled at 1% volume fraction in water. With NTA we found that for both particle types, milling led to a reduction in hydrodynamic radii. Conversely, the average intrinsic viscosity of titania decreased, while it increased for alumina with increasing milling time. By assuming aggregates were quasifractal in morphology (and hence characterized by the number of primary per particles per aggregate, the pre-exponential factor, and the fractal dimension) and by using Monte Carlo based techniques to link quasifractal aggregate descriptors to both the hydrodynamic radius and the intrinsic viscosity for an aggregate, measured hydrodynamic radius distribution functions and average intrinsic viscosities were used to infer titania and alumina aggregate quasifractal descriptors as functions of milling time. Through this analysis we found that both particle types were initially dense aggregates (fractal dimensions >. 2.9), and for titania milling did not alter aggregate morphology (i.e. titania aggregates remained dense). However, alumina aggregates were found to decrease in fractal dimension with increasing milling time, reaching a value near 1.6 after 180. minutes of milling. Such chain-like structures give rise to an increase in suspension viscosity despite the fact that alumina aggregate size decreased with milling. Overall, we show that depending on the particle material (and surfactant employed), milling may simultaneously lead to aggregate size reduction and restructuring, and may be a viable approach to the production of controlled morphology aggregates. ? 2014 Elsevier B.V.",Aggregates; Bead milling; Communition; Nanoparticles; Quasifractals
K?rberg T.,Digital preservation of knowledge in the public sector: a pre-ingest tool,2015,https://www.scopus.com/inward/record.uri?eid=2-s2.0-84883626053&doi=10.1007%2fs10502-013-9211-z&partnerID=40&md5=09ffebba286c1d569630a8a33c658a0e,"This paper describes the need for coordinating pre-ingest activities in digital preservation of archival records. As a result of the wide use of electronic records management systems (ERMS) in agencies, the focus is on several issues relating to the interaction of the agency¡¯s ERMS and public repositories. This paper indicates the importance of using digital recordkeeping metadata to meet more precisely and at the same time semi-automatically the criteria set by memory institutions. The paper provides an overview of one prospective solution and describes the Estonian National Archives¡¯ universal archiving module (UAM). A case study reports the use of the UAM in preserving the digital records of the Estonian Minister for Population and Ethnic Affairs. In this project, the preparation and transfer of archival records was divided into ten phases, starting from the description of the archival creator and ending with controlled transfer. The case study raises questions about how much recordkeeping metadata can be used in archival description and how the interaction of the agency¡¯s ERMS and ingest by the archives could be more automated. The main issues (e.g. classification, metadata elements variations, mapping, and computer files conversions) encountered during that project are discussed. Findings show that the Open Archival Information System functional model¡¯s ingest part should be reconceptualised to take into account preparatory work. Adding detailed metadata about the structure, context and relationships in the right place at the right time could get one step closer to digital codified knowledge archiving by creating synergies with various other digital repositories. ? 2013, Springer Science+Business Media Dordrecht.",Digital preservation; Estonia; Ingest; Pre-ingest; Universal archiving module
"Kepenek F., Koc Z.P., Orhan I., Balc? T.A., Aydin F., G?ng?r A.F., Ozan T., Tektas C.",Classical vs. unit area method in the evaluation of differential renal function in unilateral hydronephrosis,2015,https://www.scopus.com/inward/record.uri?eid=2-s2.0-85117624696&doi=10.1515%2fdx-2014-0044&partnerID=40&md5=6a16a9cc6c8d20f759b98915aa820a8c,"There are some problematic results in determination of differential renal function (DRF) by means of Tc-99m DMSA renal scintigraphy in hydronephrotic kidneys. In this study the classical method (CM) and unit area methods (UAM) in the estimation of DRF in unilateral hydronephrosis before and after intervention were compared. Methods: Twenty patients (12 M, 8 F; mean: 42.6¡¾18.5 years old) who were candidates for surgery or intervention because of unilateral hydronephrosis were the subjects of this study. All the patients were evaluated by Tc-99m DMSA scintigraphy before and 3-6 months after the intervention. In order to estimate DRF both CM and UAM (obtained by division of the counts including the kidney ROI to pixel of the same ROI) were performed. Bland-Altman analyses were performed in order to compare the DRF values obtained from both methods. Results: The agreement between CM and UAM was poor in the preoperative estimation, however, the agreement was good after the operation or intervention. Conclusions: In this study it seems that DRF estimation with CM in unilateral hydronephrosis might be problematic in the determination of surgery thus UAM might be introduced as the method of choice in the determination of DRF in unilateral hyronephrosis. ? 2014, Zehra Pinar Ko? et al.",Differential renal function; DMSA; hydronephrosis; unit area
"Sumiyoshi M., Inamura T., Nakamura A., Aohara T., Ishii T., Satoh S., Iwai H.",UDP-Arabinopyranose mutase 3 is required for pollen wall morphogenesis in Rice (Oryza sativa),2015,https://www.scopus.com/inward/record.uri?eid=2-s2.0-84928723716&doi=10.1093%2fpcp%2fpcu132&partnerID=40&md5=307d0f54714a60ef14f3951189eb2285,"L-Arabinose is one of the main constituents of cell wall polysaccharides such as pectic rhamnogalacturonan I (RG-I), glucuronoarabinoxylans and other glycoproteins. It is found predominantly in the furanose form rather than in the thermodynamically more stable pyranose form. UDPL-Arabinofuranose (UDP-Araf ), rather than UDP-L-Arabinopyranose (UDP-Arap), is a sugar donor for the biosynthesis of arabinofuranosyl (Araf ) residues. UDP-Arabinopyranose mutases (UAMs) have been shown to interconvert UDPAraf and UDP-Arap and are involved in the biosynthesis of polysaccharides including Araf. The UAM gene family has three members in Oryza sativa. Co-expression network in silico analysis showed that OsUAM3 expression was independent from OsUAM1 and OsUAM2 co-expression networks. OsUAM1 and OsUAM2 were expressed ubiquitously throughout plant development, but OsUAM3 was expressed primarily in reproductive tissue, particularly at the pollen cell wall formation developmental stage. OsUAM3 coexpression networks include pectin catabolic enzymes. To determine the function of OsUAMs in reproductive tissues, we analyzed RNA interference (RNAi)-knockdown transformants (OsUAM3-KD) specific for OsUAM3. OsUAM3-KD plants grew normally and showed abnormal phenotypes in reproductive tissues, especially in terms of the pollen cell wall and exine. In addition, we examined modifications of cell wall polysaccharides at the cellular level using antibodies against polysaccharides including Araf. Immunolocalization of arabinan using the LM6 antibody showed low levels of arabinan in OsUAM3-KD pollen grains. Our results suggest that the function of OsUAM3 is important for synthesis of arabinan side chains of RG-I and is required for reproductive developmental processes, especially the formation of the cell wall in pollen. ? The Author 2014. Published by Oxford University Press on behalf of Japanese Society of Plant Physiologists. All rights reserved.",Arabinan; Intine; Pectin; Pollen; Rice; UDP-Arabinopyranose mutase
"Chen J., Xu J., Jensen R., Kabrick J.",Changes in aboveground biomass following alternative harvesting in oak-hickory forests in the eastern USA,2015,https://www.scopus.com/inward/record.uri?eid=2-s2.0-84943262914&doi=10.3832%2fifor1349-007&partnerID=40&md5=f2e400d80970fe6653af659949c0a3b6,"Managing forest lands for the sustainability of ecosystem functions and services by developing and implementing sound silvicultural methods through site-specific practices is a core concept in ecosystem management. In this study, we used long-term data collected at the extensive plots of the Missouri Forest Ecosystem Project (MOFEP) in the southeastern Missouri Ozarks (USA) to study the changes in aboveground biomass (AGB) under three silvicultural treatments: even-aged management sites (EAM), uneven-aged management sites (UAM), and non-harvested management sites (NHM). Treatments changed the magnitude of AGB dynamics. The forests maintained an AGB of 147.9 Mg ha-1 in 1990 and it increased to 175.6 Mg ha-1 by 2009. The forests were manipulated with four treatments: clear-cut, non-harvest, uneven-aged single-tree, and uneven- aged group selection and yielded AGB values of 30.7, 139.5, 125.7, and 148.7 Mg ha-1 of AGB in 2009, respectively. Over the 18-year study period, these forests accumulated 1.78 ¡¾ 0.26 Mg ha-1 yr-1, ranging from 1.60 to 1.94 Mg ha-1 yr-1 at the NHM plots. Changes in the net AGB growth rate were contributed by different growth rates of live trees and mortality and exhibited clear intra-annual variation during the five sampling periods. We observed a decreasing contribution of Quercus velutina (black oak) AGB (~6%), an increasing trend for Q. alba (white oak), and a stable change for Q. coccinea (scarlet oak) during the study period. ? SISEF.",Aboveground biomass; Alternative harvest; Carbon; Forest management; MOFEP; Oak-hickory forest
"Ram?rez-De-La-Cruz A., Ram?rez-De-La-Rosa G., S?nchez-S?nchez C., Jim?nez-Salazar H., Rodr?guez-Lucatero C., Luna-Ram?rez W.A.",High level features for detecting source code plagiarism across programming languages,2015,https://www.scopus.com/inward/record.uri?eid=2-s2.0-84977598174&partnerID=40&md5=aeae14cb0b54a8a480bb9b579b9a2fb8,"In this paper we describe the participation of the Language and Reasoning group from UAM-C in the context of the Cross Language SOurce COde re-use competition (CL-SOCO 2015). We proposed a representation of source code pairs by using five high level features; namely: i) lexical feature, ii) stylistic feature, iii) comments feature, iv) programmer's text feature, and v) structure feature. We combine these different representations in three ways, each of which was a run submission for the CL-SOCO competition. Obtained results indicate that proposed representations provide some information that allows to detect particular cases of source code re-use.",Document representation; High level feature; Plagiarism detection; Source code plagiarism
"Porter N., Avramova M., Ivanov K.",Uncertainty and sensitivity analysis of COBRA-TF for the oecd LWR UAM benchmark using Dakota,2015,https://www.scopus.com/inward/record.uri?eid=2-s2.0-84964038671&partnerID=40&md5=282c78b3bb6a67bc3b8bc0391017f595,"This paper describes the results of a quantitative statistical uncertainty analysis of five cases from the OECD/NEA Uncertainty Analysis in Modeling (UAM) Benchmark. The codes used for this study were the Pennsylvania State University (PSU) version of the thermal hydraulic subchannel code COBRA-TF (COolant Boiling in Rod Array - Two Fluid) and the statistical analysis tool Dakota (Design Analysis Kit for Optimization and Terascale Applications) from Sandia National Laboratories. Four steady state cases and one transient case arc included from Phase II, Exercise 3 of the UAM Benchmark. A large variety of output parameters are analyzed for each test case: maximum void fraction, maximum fuel temperature, maximum cladding temperature, bundle pressure drop, a variety of axial distributions for a central subchannel, and the radial distribution of void fraction at the exit of the assembly. The predicted uncertainty in all parameters is low for all cases. The dominant sources of uncertainty arc inferred from rank correlation coefficients between the input and output parameters. The results agree well with similar past studies, but using a different method for sample size selection and the newest versions of the UAM benchmark and COBRA-TF. This study makes the following contributions to the existing literature: An analysis of the axial development of sensitivity information, the inclusion of a transient case, and an in-depth analysis of the geometry uncertainty treatment suggested by the UAM benchmark. Recommendations for future work are made, with an emphasis on the importance of a quantitative method for determination of the modeling parameter uncertainties.",COBRA-TF; Dakota; Subchannel codes; Thermal hydraulics; Uncertainty analysis
"Gil-Rodr?guez A.M., Carrascosa A.V., Requena T.",Yeasts in foods and beverages: In vitro characterisation of probiotic traits,2015,https://www.scopus.com/inward/record.uri?eid=2-s2.0-84944315453&doi=10.1016%2fj.lwt.2015.07.042&partnerID=40&md5=b11b0e4f15867505314c27d3fd671226,"The possible beneficial properties of food and associated microorganisms for both human and animal health are increasingly investigated. While many bacteria have been characterised as probiotics, only one yeast variety, Saccharomyces cerevisiae var. boulardii, has been recognised to be part of this group, regardless of the importance of yeasts in the food industry. In this work, we have studied the probiotic or health-beneficial potential of 130 yeast strains isolated from food belonging to the collection of the Institute of Food Science Research CIAL (CSIC-UAM). To that end, the response of these yeasts to physiological conditions during consumption has been assessed through measuring their capacity to grow at 37 ¡ÆC and to survive the gastrointestinal transit conditions. Almost 50% of the yeast analysed could thrive at the host intestine temperature, and of these, almost 37% had growth kinetic parameters higher at 37 ¡ÆC than at 25 ¡ÆC. In addition, about 95% of the strains could survive the exposition to conditions simulating the gastrointestinal transit. The yeast strains were also analysed for exhibiting auto-aggregation phenotype, antioxidant activity and the production of killer peptides, this only found in 8.5% of the strains analysed. These properties could be regarded as additional interesting features for selecting new probiotic strains. ? 2015 Elsevier Ltd.",Antioxidant activity; Gastrointestinal transit; Killer peptides; Probiotics; Yeasts
"G??s M., Pitassi T., Watson T.",Zero-information protocols and unambiguity in Arthur-Merlin communication [extended abstract],2015,https://www.scopus.com/inward/record.uri?eid=2-s2.0-84922115365&doi=10.1145%2f2688073.2688074&partnerID=40&md5=30f3c58240096d84c1664404fef0ee97,"We study whether information complexity can be used to attack the long-standing open problem of proving lower bounds against Arthur{Merlin (AM) communication protocols. Our starting point is to show that|in contrast to plain randomized communication complexity|every boolean function admits an AM communication protocol where on each yesinput, the distribution of Merlin's proof leaks no information about the input and moreover, this proof is unique for each outcome of Arthur's randomness. We posit that these two properties of zero information leakage and unambiguity on yes-inputs are interesting in their own right and worthy of investigation as new avenues toward AM. Zero-information protocols (ZAM). Our basic ZAM protocol uses exponential communication for some functions, and this raises the question of whether more efficient protocols exist. We prove that all functions in the classical space-bounded complexity classes NL and L have polynomial-communication ZAM protocols. We also prove that ZAM complexity is lower bounded by conondeterministic communication complexity. Unambiguous protocols (UAM). Our most technically substantial result is a (n) lower bound on the UAM complexity of the NP-complete set-intersection function; the proof uses information complexity arguments in a new, indirect way and overcomes the ""zero-information barrier"" described above. We also prove that in general, UAM complexity is lower bounded by the classic discrepancy bound, and we give evidence that it is not generally lower bounded by the classic corruption bound.",Arthur-Merlin protocols; Communication complexity; Information complexity
"Lozano J.H., Capote E., Fern?ndez M.P.",Convergent validity of the measures of attention and impulsivity in the trees: Simple visual discrimination test (divisa-uam) [Validez convergente de las medidas de atenci?n e impulsividad del test de discriminaci?n visual simple de ?rboles (DiViSA-UAM)],2015,https://www.scopus.com/inward/record.uri?eid=2-s2.0-84920973149&doi=10.6018%2fanalesps.31.1.161371&partnerID=40&md5=7b95f5c8dae060a2666272a7d64ec8d7,"The Trees: Simple Visual Discrimination Test (DiViSA-UAM) is an objective test to assess attention and impulsivity in children aged between 6 and 12 years. The aim of this study was to supplement the validity data obtained in prior research, analyzing the evidence of convergent validity of the measures of the DiViSA-UAM in relation to other, already well-established, instruments for assessing attention and inhibitory control in children: the ¡®Faces¡¯, Differences Perception Test and the d2 Test of Attention. To this end, the instruments were administered to a sample of 111 students from primary education (46 girls and 65 boys) between the ages of 8 and 12 years. The correlation analysis showed values in line with expectations among the indices of the three tests. Similarly to what has been observed in prior research, the three tests coincided in identifying a progressive increase in attention performance between the ages of 8 and 12, as well as stability in impulsivity control and the absence of sex-related differences. We discuss the potential advantages of the DiViSA-UAM derived from its appli-cation format and its greater ease of execution. ? 2015: Servicio de Publicaciones de la Universidad de Murcia.",Attention; Computerized tests; Convergent validity; DiViSA-UAM; Impulsivity
"Bar?n-Sola ?., Sanz-Alf?rez S., del Campo F.F.","First evidence of accumulation in cyanobacteria of guanidinoacetate, a precursor of the toxin cylindrospermopsin",2015,https://www.scopus.com/inward/record.uri?eid=2-s2.0-84919740722&doi=10.1016%2fj.chemosphere.2014.08.046&partnerID=40&md5=cfc0ff75897a27cf26725ede74c5ffc9,"Guanidinoacetate (GAA) is one of the most extensively studied toxic guanidine compounds. Changes in GAA can affect the nervous system and induce hyperhomocysteinemia, representing a risk factor for cardiovascular diseases. In cyanobacteria, GAA is thought to be an intermediate in the synthesis of the toxin cylindrospermopsin (CYN), one of the most common known cyanotoxins that affects multiple organs and functions in animals and plants. In spite of the evidence supporting GAA toxicity and its role in CYN synthesis, no data have been reported on the accumulation of GAA in any cyanobacterium. We have analyzed and compared the content of GAA in cultures of diverse cyanobacteria types, both cylindrospermopsin producing (CYN+) and not producing (CYN-). The results obtained show that GAA accumulates in the majority of the strains tested, although the highest content was found in one of the CYN+ strain, Aphanizomenon ovalisporum UAM-MAO. In this strain, both GAA and CYN can be located within and out the cells. In conclusion, GAA appears to be a general cyanobacterial metabolite that due to its proven toxic should be considered when studying and managing cyanobacteria toxicity. ? 2014 Elsevier Ltd.",Aphanizomenon ovalisporum; Cyanobacteria toxicity; Cylindrospermopsin; Guanidino compounds; Guanidinoacetate
Llinares A.,A genre approach to the effect of academic questions on CLIL students¡¯ language production,2015,https://www.scopus.com/inward/record.uri?eid=2-s2.0-84911988227&doi=10.1080%2f09500782.2014.924964&partnerID=40&md5=c9e14b9c953b2b237b5dfee1ade74fcf,"This paper presents an analysis of teachers¡¯ questions and students¡¯ responses in content and language integrated learning (CLIL) classes of history. Through the combined application of genre theory and a typology of CLIL teacher academic questions, the study aims at contributing to the understanding of how CLIL students use the foreign language to express academic meanings. The data are part of the UAM-CLIL project, which focuses on the systemic-functional analysis of CLIL students¡¯ language production. In this paper, we analyze class discussions on various topics in two secondary schools. These discussions were carried out at the end of a topic and followed a prompt that aimed at triggering participation in different history genres: recount, account, explanation and argument. The aim of the study is twofold: first, the academic questions used by the teachers are classified in relation to the genre triggered by the prompt; second, we analyze the length and complexity of the students¡¯ responses. The results show that the teachers did not always ask the questions related to the prompt. In fact, they frequently used questions for facts, which usually triggered shorter and less complex responses than other types. ? 2014, ? 2014 Taylor & Francis.",academic questions; classroom interaction; CLIL; genre; systemic-functional linguistics
"D?ez C.J., Buss O., Hoefer A., Porsch D., Cabellos O.",Comparison of nuclear data uncertainty propagation methodologies for PWR burn-up simulations,2015,https://www.scopus.com/inward/record.uri?eid=2-s2.0-84911479554&doi=10.1016%2fj.anucene.2014.10.022&partnerID=40&md5=38a4979d5fff7df94beb34e2cb6d926a,"Several methodologies using different levels of approximations have been developed for propagating nuclear data uncertainties in nuclear burn-up simulations. Most methods fall into the two broad classes of Monte Carlo approaches, which are exact apart from statistical uncertainties but require additional computation time, and first order perturbation theory approaches, which are efficient for not too large numbers of considered response functions but only applicable for sufficiently small nuclear data uncertainties. Some methods neglect isotopic composition uncertainties induced by the depletion steps of the simulations, others neglect neutron flux uncertainties, and the accuracy of a given approximation is often very hard to quantify. In order to get a better sense of the impact of different approximations, this work aims to compare results obtained based on different approximate methodologies with an exact method, namely the NUDUNA Monte Carlo based approach developed by AREVA GmbH. In addition, the impact of different covariance data is studied by comparing two of the presently most complete nuclear data covariance libraries (ENDF/B-VII.1 and SCALE 6.0), which reveals a high dependency of the uncertainty estimates on the source of covariance data. The burn-up benchmark Exercise I-1b proposed by the OECD expert group ""Benchmarks for Uncertainty Analysis in Modeling (UAM) for the Design, Operation and Safety Analysis of LWRs"" is studied as an example application. The burn-up simulations are performed with the SCALE 6.0 tool suite. ? 2014 Elsevier Ltd. All rights reserved.",Burn-up; Hybrid Method; Nuclear data uncertainties; NUDUNA; PWR; Uncertainty quantification
