Authors,Title,Year,Link,Abstract,Author Keywords
[No author name available],SKYWAYS: The future of Urban Air Delivery,2018,https://www.scopus.com/inward/record.uri?eid=2-s2.0-85049966615&doi=10.1109%2fICNSURV.2018.8385025&partnerID=40&md5=a02b2150a6ef6c6f17c0ff5969b372cb,"Innovative UAS for Urban Last mile delivery ? Embodying Aviation Standarts for Public Safety ? Full Autonomy: Self navigation & a automatic cargo handling ? Participating to setting regulatory and operational requirements standard for UAM Drone designed by legacy aviation ? Exploring Urban Air Delivery with 'Aviation Safe' Multi-rotor UAS - initial payload of 2kg to 4kg, total load of approximately 25kg ? Developing Urban UAS Certification and BVLOS Regulations with Authorities. ? 2018 IEEE.",
"Zecher D., Bach C., Preiss A., Staudner C., Utpatel K., Evert M., Jung B., Bergler T., B?ger C.A., Spriewald B.M., Banas B.",Analysis of Luminex-based Algorithms to Define Unacceptable HLA Antibodies in CDC-crossmatch Negative Kidney Transplant Recipients,2018,https://www.scopus.com/inward/record.uri?eid=2-s2.0-85048021276&doi=10.1097%2fTP.0000000000002129&partnerID=40&md5=a4483256931c6e8c9c920994d81f60ed,"Background HLA-specific antibodies detected by solid phase assays are increasingly used to define unacceptable HLA antigen mismatches (UAM) before renal transplantation. The accuracy of this approach is unclear. Methods Day of transplant sera from 211 complement-dependent cytotoxicity crossmatch-negative patients were retrospectively analyzed for donor-specific anti-HLA antibodies (DSA) using Luminex technology. HLA were defined as UAM if DSA had mean fluorescence intensity above (I) 3000 (patients retransplanted and those with DSA against HLA class I and II) or 5000 (all other patients), (II) 5000 for HLA-A, -B, and -DR and 10 000 for HLA DQ or (III) 10 000 (all HLA). We then studied the accuracy of these algorithms to identify patients with antibody-mediated rejection (AMR) and graft loss. UAM were also determined in 256 transplant candidates and vPRA levels calculated. Results At transplantation, 67 of 211 patients had DSA. Of these, 31 (algorithm I), 24 (II) and 17 (III) had UAM. Nine (I and II) and 8 (III) of 11 early AMR episodes and 7 (I), 6 (II) and 5 (III) of 9 graft losses occurred in UAM-positive patients during 4.9 years of follow-up. Algorithms I and II identified patients with persistently lower glomerular filtration rate even in the absence of overt AMR. Of the waiting list patients, 22-33% had UAM with median virtual panel reactive antibody of 69.2% to 79.1%. Conclusions Algorithms I and II had comparable efficacy but were superior to Algorithm III in identifying at-risk patients at an acceptable false-positive rate. However, Luminex-defined UAM significantly restrict the donor pool of affected patients, which might prolong waiting time. ? 2018 Wolters Kluwer Health, Inc. All rights reserved.",
"Roy D., C. K.M.",Snatch theft detection in unconstrained surveillance videos using action attribute modelling,2018,https://www.scopus.com/inward/record.uri?eid=2-s2.0-85045759651&doi=10.1016%2fj.patrec.2018.03.004&partnerID=40&md5=8c5454d9e356063e4ae705070cadf7f6,"In a city with hundreds of cameras and thousands of interactions daily among people, manually identifying crimes like chain and purse snatching is a tedious and challenging task. Snatch thefts are complex actions containing attributes like walking, running etc. which are affected by actor and view variations. To capture the variation in these attributes in diverse scenarios, we propose to model snatch thefts using a Gaussian mixture model (GMM) with a large number of mixtures known as universal attribute model (UAM). However, the number of snatch thefts typically recorded in a surveillance videos is not sufficient enough to train the parameters of the UAM. Hence, we use the large human action datasets like UCF101 and HMDB51 to train the UAM as many of the actions in these datasets share attributes with snatch thefts. Then, a super-vector representation for each snatch theft clip is obtained using maximum aposteriori (MAP) adaptation of the universal attribute model. However, super-vectors are high-dimensional and contain many redundant attributes which do not contribute to snatch thefts. So, we propose to use factor analysis to obtain a low-dimensional representation called action-vector that contains only the relevant attributes. For evaluation, we introduce a video dataset called Snatch 1.0 created from many hours of surveillance footage obtained from different traffic cameras placed in the city of Hyderabad, India. We show that using action-vectors snatch thefts can be better identified than existing state-of-the-art feature representations. ? 2018",Action recognition; Factor analysis; Gaussian mixture model; Snatch theft detection; Surveillance
"Nadimpalli V.K., Nagy P.B.",Designing an in-situ ultrasonic nondestructive evaluation system for ultrasonic additive manufacturing,2018,https://www.scopus.com/inward/record.uri?eid=2-s2.0-85046406029&doi=10.1063%2f1.5031502&partnerID=40&md5=bdf1281216b66eafafa4ee12ae25d7d2,"Ultrasonic Additive Manufacturing (UAM) is a solid-state layer by layer manufacturing process that utilizes vibration induced plastic deformation to form a metallurgical bond between a thin layer and an existing base structure. Due to the vibration based bonding mechanism, the quality of components at each layer depends on the geometry of the structure. In-situ monitoring during and between UAM manufacturing steps offers the potential for closed-loop control to optimize process parameters and to repair existing defects. One interface that is most prone to delamination is the base/build interface and often UAM component height and quality are limited by failure at the base/build interface. Low manufacturing temperatures and favorable orientation of typical interface defects in UAM make ultrasonic NDE an attractive candidate for online monitoring. Two approaches for in-situ NDE are discussed and the design of the monitoring system optimized so that the quality of UAM components is not affected by the addition of the NDE setup. Preliminary results from in-situ ultrasonic NDE indicate the potential to be utilized for online qualification, closed-loop control and offline certification of UAM components. ? 2018 Author(s).",
"Chima A.M., Koka R., Lee B., Tran T., Ogbuagu O.U., Nelson-Williams H., Rosen M., Koroma M., Sampson J.B.",Medical Simulation as a Vital Adjunct to Identifying Clinical Life-Threatening Gaps in Austere Environments,2018,https://www.scopus.com/inward/record.uri?eid=2-s2.0-85041309974&doi=10.1016%2fj.jnma.2017.12.003&partnerID=40&md5=e1da897222ddad5f27a041a89be07073,"Background: Maternal mortality and morbidity are major causes of death in low-resource countries, especially those in Sub-Saharan Africa. Healthcare workforce scarcities present in these locations result in poor perioperative care access and quality. These scarcities also limit the capacity for progressive development and enhancement of workforce training, and skills through continuing medical education. Newly available low-cost, in-situ simulation systems make it possible for a small cadre of trainers to use simulation to identify areas needing improvement and to rehearse best practice approaches, relevant to the context of target environments. Methods: Nurse anesthetists were recruited throughout Sierra Leone to participate in simulation-based obstetric anesthesia scenarios at the country's national referral maternity hospital. All subjects participated in a detailed computer assisted training program to familiarize themselves with the Universal Anesthesia Machine (UAM). An expert panel rated the morbidity/mortality risk of pre-identified critical incidents within the scenario via the Delphi process. Participant responses to critical incidents were observed during these scenarios. Participants had an obstetric anesthesia pretest and post-test as well as debrief sessions focused on reviewing the significance of critical incident responses observed during the scenario. Results: 21 nurse anesthetists, (20% of anesthesia providers nationally) participated. Median age was 41 years and median experience practicing anesthesia was 3.5 years. Most participants (57.1%) were female, two-thirds (66.7%) performed obstetrics anesthesia daily but 57.1% had no experience using the UAM. During the simulation, participants were observed and assessed on critical incident responses for case preparation with a median score of 7 out of 13 points, anesthesia management with a median score of 10 out of 20 points and rapid sequence intubation with a median score of 3 out of 10 points. Conclusion: This study identified substantial risks to patient care and provides evidence to support the feasibility and value of in-situ simulation-based performance assessment for identifying critical gaps in safe anesthesia care in the low-resource settings. Further investigations may validate the impact and sustainability of simulation based training on skills transfer and retention among anesthesia providers low resource environments. ? 2018 The Authors",Africa; Anesthesia; Low-resource environment; Sierra Leone; Simulation; Training
"del-Valle-Gallegos E., Lopez-Solis R., Arriaga-Ramirez L., Gomez-Torres A., Puente-Espel F.",Verification of the multi-group diffusion code AZNHEX using the OECD/NEA UAM Sodium Fast Reactor Benchmark,2018,https://www.scopus.com/inward/record.uri?eid=2-s2.0-85040964828&doi=10.1016%2fj.anucene.2017.12.062&partnerID=40&md5=53c7881124f1d0198e8c754dfee33c01,"AZNHEX is a novel 3D neutron diffusion code for nuclear core analysis with hexagonal-z geometry, and it is part of the Mexican project on the development of domestic nuclear analysis software ¡°AZTLAN Platform¡±. Currently, the code is under development but some important steps have been made in the verification procedure of the code. A composite nodal method for prismatic hexagons has been developed and applied to solve the neutron diffusion equations for cores built by the union, side by side, of hexagonal prisms. A standard finite element method is used starting by the strong form to get the corresponding weak form. The verification and validation process of the AZNHEX code started with some academic exercises. In the case of this paper, in order to move to much more realistic scenarios, the OECD/NEA UAM Sodium Fast Reactor Benchmark has been used together with the SERPENT code for further verification. One of the exercises of the OECD/NEA Sodium Fast Reactor Benchmark is focused on the neutronic characterization of global parameters (keff, sodium void worth, Doppler, etc.) and feedback coefficient evaluation. This Benchmark is intended to confirm the ability of participants and their neutronic codes to provide generally consistent results when analyzing SFR core characteristics and thus, it represents a very good exercise for the AZNHEX development team. The differences in keff of AZNHEX versus the well validated deterministic codes DYN3D and PARCS are 70 pcm and 113 pcm respectively when using the same set of XS previously generated with the stochastic code SERPENT. Also, the radial power distribution compared between the deterministic codes over the main diagonal of the core presented very good agreement among them. In other exercises, differences in the order of 200 pcm, in the worst cases, were found when comparing integral parameters with SERPENT. The AZNHEX results give the confidence to keep developing the code in order to convert it into the standard domestic tool for hexagonal-z geometry core analysis. Future developments on the code will be focused on the implementation of discontinuity factors and the thermal expansion effects in an operating core as well as the time dependent implementation. ? 2018 Elsevier Ltd",AZNHEX for FR analysis; Hexagonal-z geometry solver; Neutron diffusion code AZNHEX; OECD/NEA UAM Sodium Fast Reactor Benchmark
"Castro E., S?nchez-Cervera S., Garc?a-Herranz N., Cuervo D.","Impact of the homogenization level, nodal or pin-by-pin, on the uncertainty quantification with core simulators",2018,https://www.scopus.com/inward/record.uri?eid=2-s2.0-85031316608&doi=10.1016%2fj.pnucene.2017.10.001&partnerID=40&md5=934c255c172e881d9fbb4f8b022ea7e8,"This paper assesses the impact of the homogenization level (nodal or pin-by-pin) on the uncertainties predicted by core simulators, highlighting the need of calculations at pin level for a reliable estimate of uncertainties in hot channel factors. In order to perform the analysis, two methodologies for nuclear data uncertainty quantification in stand-alone neutronics calculations have been implemented in the core simulator COBAYA. The first one is based on first-order perturbation theory and allows sensitivity/uncertainty analysis in the multiplication factor. The second one is based on random sampling and allows the uncertainty propagation in all responses computed by the code. Both methodologies are used in conjunction with SCALE system, which provides the capabilities to propagate the nuclear data uncertainties into the few-group constants required for the diffusion calculations. These methodologies are validated using a simplified pin-cell and a fuel assembly, and then applied to a full 3D core in the context of the OECD/NEA UAM benchmark (Uncertainty Analysis in Best-Estimate Modeling for Design, Operation and Safety Analysis of LWRs). ? 2017 Elsevier Ltd",Core simulator; Nodal and pin-by-pin; Perturbation theory-based method; Sampling-based method; Uncertainty quantification
"Toledo-Cervantes A., Gardu?o Sol?rzano G., Campos J.E., Mart?nez-Garc?a M., Morales M.",Characterization of Scenedesmus obtusiusculus AT-UAM for high-energy molecules accumulation: deeper insight into biotechnological potential of strains of the same species,2018,https://www.scopus.com/inward/record.uri?eid=2-s2.0-85037709750&doi=10.1016%2fj.btre.2017.11.009&partnerID=40&md5=75ade72d92e54d0af70b068169cb6c6a,"Scenedesmus obtusiusculus AT-UAM, isolated from Cuatro Ci?negas wetlands in Mexico was taxonomically, molecularly and biochemically compared to S. obtusiusculus CCAP 276/25 (Culture Collection of Algae and Protozoa, Scotland, UK). Analysis of Internal Transcribed Spacer 2 (ITS2) secondary structures confirmed that the mexican strain belongs to S. obtusiusculus with one change in the ITS2 nucleotide sequence. However, both strains exhibited different biochemical and fatty acid profiles and therefore biotechnological potential, emphasizing the need for deeper studies among strains of the same species. Furthermore, the biochemical variations of S. obtusiusculus AT-UAM under nitrogen starvation and different levels of irradiance were evaluated. The maximum lipid production (1730 mg L?1) was obtained at 613 ¥ìmol m?2 s?1 while the highest carbohydrate content (49%) was achieved at 896 ¥ìmol m?2 s?1. Additionally, this strain was capable of storing lipids (¡­52%) and carbohydrates (¡­40%) under outdoor condition depending on the light availability in the cultivation broth. ? 2017 The Authors",Carbohydrates; ITS2; Lipids; Morphological characterization; Scenedesmus obtusiusculus
"Honta H., Inamura T., Konishi T., Satoh S., Iwai H.","UDP-arabinopyranose mutase gene expressions are required for the biosynthesis of the arabinose side chain of both pectin and arabinoxyloglucan, and normal leaf expansion in Nicotiana tabacum",2018,https://www.scopus.com/inward/record.uri?eid=2-s2.0-85031800319&doi=10.1007%2fs10265-017-0985-6&partnerID=40&md5=2e048cc6fa87a01ddfc149204590dea8,"Plant cell walls are composed of polysaccharides such as cellulose, hemicelluloses, and pectins, whose location and function differ depending on plant type. Arabinose is a constituent of many different cell wall components, including pectic rhamnogalacturonan I (RG-I) and II (RG-II), glucuronoarabinoxylans (GAX), and arabinoxyloglucan (AXG). Arabinose is found predominantly in the furanose rather than in the thermodynamically more stable pyranose form. The UDP-arabinopyranose mutases (UAMs) have been demonstrated to convert UDP-arabinopyranose (UDP-Arap) to UDP-arabinofuranose (UDP-Araf) in rice (Oryza sativa L.). The UAMs have been implicated in polysaccharide biosynthesis and developmental processes. Arabinose residues could be a component of many polysaccharides, including branched (1¡æ5)-¥á-arabinans, arabinogalactans in pectic polysaccharides, and arabinoxyloglucans, which are abundant in the cell walls of solanaceous plants. Therefore, to elucidate the role of UAMs and arabinan side chains, we analyzed the UAM RNA interference transformants in tobacco (Nicotiana tabacum L.). The tobacco UAM gene family consists of four members. We generated RNAi transformants (NtUAM-KD) to down-regulate all four of the UAM members. The NtUAM-KD showed abnormal leaf development in the form of a callus-like structure and many holes in the leaf epidermis. A clear reduction in the pectic arabinan content was observed in the tissue of the NtUAM-KD leaf. The arabinose/xylose ratio in the xyloglucan-rich cell wall fraction was drastically reduced in NtUAM-KD. These results suggest that UAMs are required for Ara side chain biosynthesis in both RG-I and AXG in Solanaceae plants, and that arabinan-mediated cell wall networks might be important for normal leaf expansion. ? 2017, The Botanical Society of Japan and Springer Japan KK.",Arabinoxyloglucan; Nicotiana tabacum; Rhamnogalacturonan-I; UDP-arabinopyranose mutase
"Kuan G., Morris T., Kueh Y.C., Terry P.C.","Effects of relaxing and arousing music during imagery training on dart-throwing performance, physiological arousal indices, and competitive state anxiety",2018,https://www.scopus.com/inward/record.uri?eid=2-s2.0-85041863193&doi=10.3389%2ffpsyg.2018.00014&partnerID=40&md5=6325f7179746a644bb0166be4f6525d0,"Music that is carefully selected to match the requirements of activities and the characteristics of individuals has been shown to produce significant impacts on performance enhancement (Priest et al., 2004). There is also evidence that music can enhance imagery (Grocke and Wigram, 2007), although few studies have investigated the effects of music on imagery in the context of sport skills. In the present study, the effects of relaxing and arousing music during imagery on dart-throwing performance, physiological arousal indices, and competitive state anxiety, were investigated among 63 novice dart throwers. Participants had moderate-to-high imagery ability and were randomly assigned to unfamiliar relaxing music (URM), unfamiliar arousing music (UAM), or no music (NM) groups. Performance was assessed by 40 dart throws at a concentric circles dartboard before and after 12 imagery sessions over 4 weeks. Measures of galvanic skin response (GSR), peripheral temperature (PT), and heart rate (HR) were taken during imagery sessions 1 and 12, and the Competitive State Anxiety Inventory-2 Revised (CSAI-2R) was administered prior to the pre- and post-intervention performance task. Dart-throwing gain scores were significantly higher for URM than for UAM and NM, with no significant difference between UAM and NM (URM = 37.24 ¡¾ 5.66, UAM = 17.57 ¡¾ 5.30, and NM = 13.19 ¡¾ 6.14, F2,62 = 5.03, p = 0.01, ¥ç2 = 0.14). GSR, PT, and HR reflected lower arousal for URM than for UAM or NM. Significant decreases in somatic anxiety were evident for URM and UAM but not NM. Significant decreases in cognitive anxiety were evident for URM and NM but not UAM. Significant increases in self-confidence were evident for URM but not UAM or NM. Performance improved in all three conditions but URM was associated with the largest performance gain, the lowest physiological indices of arousal, and the most positive CSAI-2R profiles. Listening to relaxing music during imagery may have benefits for performance in other fine motor skills. ? 2018 Kuan, Morris, Kueh and Terry.",Arousing music; Fine-motor skill performance; Imagery; Physiological arousal; Relaxing music
"Noman M.T., Militky J., Wiener J., Saskova J., Ashraf M.A., Jamshaid H., Azeem M.",Sonochemical synthesis of highly crystalline photocatalyst for industrial applications,2018,https://www.scopus.com/inward/record.uri?eid=2-s2.0-85021189920&doi=10.1016%2fj.ultras.2017.06.012&partnerID=40&md5=30561606f7a7ae22d6b1b3e484c0c4f3,"Highly photo active pure anatase form of TiO2 nanoparticles with average particle size 4 nm have been successfully synthesized by ultrasonic acoustic method (UAM). The effects of process variables i.e. precursors concentration and sonication time were investigated based on central composite design and response surface methodology. The characteristics of the resulting nanoparticles (RNP) were analyzed by scanning electron microscopy, dynamic light scattering, transmission electron microscopy, X-ray diffractometry and Raman spectroscopy. Photocatalytic experiments were performed with methylene blue dye which is considered as model organic pollutant in textile industry. A comparative analysis between the RNP and commercially available Degussa P25 for photocatalytic performance against dye removal efficiency was performed. The rapid removal of methylene blue in case of RNP indicates their higher photocatalytic activity than P25. Maximum dye removal efficiency 98.45% was achieved with optimal conditions i.e. TTIP conc. 10 mL, EG conc. 4 mL and sonication time 1 h. Interestingly, no significant difference was found in the photocatalytic performance of RNP after calcination. Moreover, self-cleaning efficiency of RNP deposited on cotton was evaluated in RGB color space. The obtained results indicate the significant impact of ultrasonic irradiations on the photocatalytic performance of pure anatase form than any other hybrid type of TiO2 nanoparticles. ? 2017 Elsevier B.V.",Anatase; Dyes removal; Ethylene glycol; RNP; RSM; Ultrasonic irradiations
"German B.J., Daskilewicz M.J., Hamilton T.K., Warren M.M.",Cargo delivery by passenger eVTOL aircraft: A case study in the san francisco bay area,2018,https://www.scopus.com/inward/record.uri?eid=2-s2.0-85141633625&doi=10.2514%2f6.2018-2006&partnerID=40&md5=e84b36e2c2e503763bf165736d4353bc,"We consider an example application of electric VTOL (eVTOL) aircraft, designed originally for passenger operations in urban air mobility (UAM) markets, for transporting cargo. The particular case study we examine involves delivering small packages from a warehouse located in Tracy, CA to vertiport hubs in the San Franciso Bay Area. The package transit is envisioned to occur via two legs: an eVTOL trip from the warehouse to a vertiport located near the consumer, followed by last-mile delivery by car, small UAS, or other mode from the vertiport to the consumer. First, we formulate and solve an optimization problem to select cargo vertiport locations by maximizing the package demand served, subject to limits on the number of vertiports. Next, we examine the sizing, mission performance, recharge time requirements, and daily package throughput of two representative classes of eVTOL vehicles for this case study example. ? 2018, American Institute of Aeronautics and Astronautics Inc, AIAA. All rights reserved.",
"Pradeep P., Wei P.",Energy efficient arrival with rta constraint for urban evtol operations,2018,https://www.scopus.com/inward/record.uri?eid=2-s2.0-85141589004&doi=10.2514%2f6.2018-2008&partnerID=40&md5=ecde2534a4f037339cf99ba74578cf0e,"The electric vertical takeoff and landing (eVTOL) air taxis can alleviate transportation congestion on the ground by utilizing three-dimensional airspace efficiently. However, the endurance of Lithium-ion Polymer (Li-Po) batteries imposes severe constraints on the operational time span of an eVTOL vehicle on an urban air mobility (UAM) passenger transport mission. This research focuses on the formulation of fixed final time multiphase optimal control problem with energy consumption as the performance index for a multirotor eVTOL vehicle. The proposed multiphase optimal control problem formulation and the numerical solution enables the eVTOL air taxi to meet the given required time of arrival (RTA) and achieve the most energy efficient arrival trajectory, which is a critical enabler for the safe and efficient future eVTOL operations for passenger transportation and cargo delivery. The problem formulation is validated in a UAM passenger transport use case with EHang 184 eVTOL air taxi and an Uber proposed vertiport in numerical simulations. However, this proposed framework can also be used to address an energy efficient cargo delivery case in a UAS traffic management (UTM) context. ? 2018 by the American Institute of Aeronautics and Astronautics, Inc. All rights reserved.",
