Authors,Title,Year,Link,Abstract,Author Keywords
"Medina N.G., Est? Banez B.N.",Does spore ultrastructure mirror different dispersal strategies in mosses? a study of seven iberian orthotrichum species,2014,https://www.scopus.com/inward/record.uri?eid=2-s2.0-84911894157&doi=10.1371%2fjournal.pone.0112867&partnerID=40&md5=2001ac58188d353b0bad7c0d12ec98f2,"Most mosses have xerochastic dispersal (i.e., they open their capsules when conditions are dry), which is thought to favor long-distance dispersal. However, there are several species that use a hygrochastic strategy: spores are dispersed when conditions are wet. The significance of this strategy in the Mediterranean region is unknown. In this study, we explored whether ultrastructural features related to differences in spore resistance may explain these different strategies of spore dispersal. To this end, we examined the ultrastructural features of the spores of seven closely related species in the moss genus Orthotrichum. These species all grow as epiphytes in sub-Mediterranean forests, and the group includes both xerochastic and hygrochastic members. First, we found that the spore wall layers exhibit several features previously undescribed in mosses. Second, we discovered that there are only subtle differences in spore ultrastructure with regards to spore wall thickness, the degree of plastid development, or the storage substances used. We suggest that the hygrochastic dispersal in mosses from Mediterranean environments might be related to a safe-site strategy, rather than to drought avoidance, and we underscore the necessity of conducting spore ultrastructural studies on a greater number of bryophyte species. 2014 Medina Est? banez. Funding: The experimental part has been partially self-funded, it also received support from the regional project ref. CCG10-UAM/AMB-5630 (UAM & Madrid). The funders had no role in study design, data collection and analysis, decision to publish, or preparation of the manuscript.",
"Licona F.M., Azpiroz-Leehan J., Medal E.G.U., Mendez M.C.",Biomedical Engineering curriculum at UAM-I: A critical review,2014,https://www.scopus.com/inward/record.uri?eid=2-s2.0-84976591542&doi=10.1109%2fEMBC.2014.6943958&partnerID=40&md5=3c0a1de1c657cb1c21bb36acfe9aeb09,"The Biomedical Engineering (BME) curriculum at Universidad Aut?noma Metropolitana (UAM) has undergone at least four major transformations since the founding of the BME undergraduate program in 1974. This work is a critical assessment of the curriculum from the point of view of its results as derived from an analysis of, among other resources, institutional databases on students, graduates and their academic performance. The results of the evaluation can help us define admission policies as well as reasonable limits on the maximum duration of undergraduate studies. Other results linked to the faculty composition and the social environment can be used to define a methodology for the evaluation of teaching and the implementation of mentoring and tutoring programs. Changes resulting from this evaluation may be the only way to assure and maintain leadership and recognition from the BME community. ? 2014 IEEE.",
"Botova M.G., Romanovskaya Y.V., Namgaladze A.A.",Electron density height profiles calculated by the theoretical upper atmosphere model: Comparison with the empirical IRI model,2014,https://www.scopus.com/inward/record.uri?eid=2-s2.0-84919755008&doi=10.1109%2fURSIGASS.2014.6929787&partnerID=40&md5=aacea1f1096e4efec2dcd69862e9fb48,We have compared the electron density height profiles calculated by the global numerical Upper Atmosphere Model with the empirical IRI-2007 and IRI-2012 model values. The comparison has been performed for two solar activity levels and different seasons. It is shown that the UAM results agree well at middle latitudes being closer to the IRI-2007 than to the IRI-2012 values. ? 2014 IEEE.,
"Martynenko O.V., Fomichev V.I., Semeniuk K., Beagley S.R., Ward W.E., McConnell J.C., Namgaladze A.A.",Physical mechanisms responsible for forming the 4-peak longitudinal structure of the 135.6nm ionospheric emission: First results from the Canadian IAM,2014,https://www.scopus.com/inward/record.uri?eid=2-s2.0-84907275579&doi=10.1016%2fj.jastp.2014.08.014&partnerID=40&md5=99b4aee66884e025d1579c3ad46a910d,"The Canadian Ionosphere and Atmosphere Model (Canadian IAM or C-IAM) is a new project aimed at the development of whole atmosphere modeling capabilities in Canada. The first version of the C-IAM is comprised of the extended Canadian Middle Atmosphere (CMAM) and the Murmansk's Upper Atmosphere Model (UAM), currently coupled in a one-way manner. The model extends from the surface to the inner magnetosphere and is able to describe the impact on the upper atmosphere and ionosphere of self-consistently generated lower atmosphere dynamical variability. In the current study, the C-IAM has been used to investigate the physical mechanisms responsible for forming the 4-peak longitudinal structure of the 135.6. nm ionospheric emission observed by the IMAGE satellite over the tropics at 20:00 local time from March 20 to April 20, 2002. To perform this study, the C-IAM has been run for this whole observation period taking into account a realistic day-to-day variation in solar and geomagnetic activity. The 4-peak longitudinal structure produced by the model and averaged over the observation period is in a good agreement with the observations. Analysis of the model results suggests that the main mechanism for generating the longitudinal structure in the ionospheric emission after sunset is a modification of the ionospheric electric field in the E region caused in the course of the daytime by differences in the diurnal evolution of the zonal wind in different longitudinal sectors due to waves penetrating from the lower atmosphere. In agreement with the earlier findings, our study showed that this mechanism is driven mainly by the diurnal eastward propagating tide with zonal number 3. A small contribution to the formation of the 4-peak structure is also provided by longitudinal variations in meridional wind and neutral composition at the F2 layer altitudes. The 4 peaks being clearly visible in the monthly mean result are not, however, present every day. Day-to-day variability of both the diurnal wind evolution and geomagnetic activity can significantly modify the longitudinal structure of the ionospheric emission. ? 2014 Elsevier Ltd.",Atmosphere-ionosphere coupling; Ionospheric emission; Whole atmosphere modeling
"Panka I., Kereszt?ri A.",Assessment of the uncertainties of COBRA sub-channel calculations by using a PWR type rod bundle and the OECD NEA UAM and the PSBT benchmarks data,2014,https://www.scopus.com/inward/record.uri?eid=2-s2.0-84908055625&doi=10.3139%2f124.110460&partnerID=40&md5=96ad80601bbc390a3087f284adba25d7,"The assessment of the uncertainties of COBRA-IIIC thermalhydraulic analyses of rod bundles is performed for a 5-by-5 bundle representing a PWR fuel assembly. In the first part of the paper the modeling uncertainties are evaluated in the term of the uncertainty of the turbulent mixing factor using the OECD NEA/NRC PSBT benchmark data. After that the uncertainties of the COBRA calculations are discussed performing Monte-Carlo type statistical analyses taking into account the modeling uncertainties and other uncertainties prescribed in the OECD NEA UAM benchmark specification. Both steady-state and transient cases are investigated. The target quantities are the uncertainties of the void distribution, the moderator density, the moderator temperature and the DNBR. We will see that - beyond the uncertainties of the geometry and the boundary conditions - it is very important to take into account the modeling uncertainties in case of bundle or sub-channel thermo-hydraulic calculations. ? Carl Hanser Verlag, M?nchen.",
"Tao Z., Wang Y., Wu Z., Hu J.",Rough approximation based decentralized bi-level model for the supply chain distribution problem,2014,https://www.scopus.com/inward/record.uri?eid=2-s2.0-84894180834&doi=10.1007%2f978-3-642-40081-0_67&partnerID=40&md5=82846c13b94a716d142090867720cd02,"This paper considers a core enterprise-dominant supply chain distribution modeling problem under a fuzzy environment. In particular, the common benefit and mutual interact of the upstream and downstream enterprise in the supply chain is considered. Thus, a decentralized bi-level programming model is constructed. To deal with the fuzzy parameters in the objective functions, an expected value operation based on Me is employed. As to the feasible region with fuzzy coefficient, a similarity relation based on the fuzzy measure Pos is defined, based on which, the rough approximation method is adopted. Then, two rough approximation models (UAM and LAM) is developed. To solve the two models, a rough simulation is developed, after which the fuzzy interactive programming and genetic algorithm can be adopted to find the solutions. ? Springer-Verlag Berlin Heidelberg 2014.",Decentralized bi-level programming; Fuzzy environment; Rough approximation; Rough simulation; Supply chain
"Molins-Ruano P., Borrego-Gallardo F., Sevilla C., Jurado F., Rodriguez P., Sacha G.M.",Constructing quality test with e-valUAM,2014,https://www.scopus.com/inward/record.uri?eid=2-s2.0-84946690584&doi=10.1109%2fSIIE.2014.7017729&partnerID=40&md5=1b97f0548127b43030bcc08366fd5d3f,"In this work, we develop a formalism based on test construction by the eval-UAM tool. This process aims to improve the quality of the assessment process by taking into account the relevance of the items. The method uses students' answers to follow different paths to improve the accuracy of the assessment process. By using this method, we improve the objectiveness and take into account the relevance of the subject contents. The method also includes a complete analysis of the individual items that, for example, can be used to discriminate the ones that are not correctly formulated or, alternatively, to detect subjects that are not correctly explained to the students in the learning process. The method is implemented in the e-valUAM application and can be directly used in computer-assisted tests for different subjects and disciplines, or as a self-evaluation tool with the objective of correcting students' deficiencies in the learning process. ? 2014 IEEE.",adaptive assessment; e-learning; test eluation
"Garc?a-Herranz N., Garrido J., Cabellos O.",Sensitivity/uncertainty analysis for bwr configurations of exercise i-2 of uam benchmark,2014,https://www.scopus.com/inward/record.uri?eid=2-s2.0-85105469303&partnerID=40&md5=bd03b5a9e39e813f45d285e85c7bff6e,"In order to evaluate the uncertainties in prediction of lattice-Averaged parameters, input data of core neutronics codes, Exercise I-2 of the OECD benchmark for uncertainty analysis in modeling (UAM) was proposed. This work aims to perform a sensitivity/uncertainty analysis of the BWR configurations defined in the benchmark for the purpose of Exercise I-2. Criticality calculations are done for a 7x7 BWR fresh fuel assembly at HFP in four configurations: single unrodded fuel assembly, rodded fuel assembly, assembly/reflector and assembly in a color-set. The SCALE6.1 code package is used to propagate cross section covariance data through lattice physics calculations to both k-effective and two-group assembly-homogenized cross sections uncertainties. Computed sensitivities and uncertainties for all configurations are analyzed and compared. It was found that uncertainties are very similar for the four test-problems, showing that the influence of the assembly environment on uncertainty prediction is very small. ? 2014 Westinghouse Electric Company LLC. All Rights Reserved.",few-group homogenized cross section uncertainties; lattice physics uncertainty propagation; sensitivity/uncertainty analysis
"Santamarina A., Blaise P., Dos Santos N., Vaglio C., De Saint-Jean C.",Nuclear data uncertainty propagation on power maps in large lwr cores,2014,https://www.scopus.com/inward/record.uri?eid=2-s2.0-85105414498&partnerID=40&md5=4f69a555a5848a7a16a72a134eda387f,"Nuclear data uncertainty propagation is more and more required in safety calculations of large NPP cores. In this study, nuclear data uncertainties have been propagated to LWR cores using accurate transport calculations. PWR benchmarks representative of the French NPP fleet were selected: one 900MWe (Fessenheim), one 1500MWe (CHOOZ), as two complementary GEN-III benchmarks belonging to the OECD/UAM benchmark, representative of large PWR UOX and partially loaded-MOX cores surrounded by thick stainless steel reflector. Reactivity and assembly power map sensitivity coefficients to multigroup cross sections have been calculated using perturbation theory tools implemented in ERANOS2/SNATCH transport code. Different sources of nuclear data uncertainty were compared: covariance matrices from BOLNA, and French COMAC associated to JEFF3.1.1 evaluations, were used for uncertainty propagation. The total uncertainty on the multiplication factor keff is not sensitive to the size and the loading of the PWR cores; this uncertainty amounts to 560pcm (1s) with COMAC, compared to 780 pcm with BOLNA covariances. The main component of keff uncertainty is U235, followed by 238U capture, sc U235 and sf U235. The uncertainty on the radial power map increases with the core size, due to higher Eigen Value Separation factor (EVS>20). For example, using COMAC covariances, the uncertainty in central assemblies increases from 1.5% for PWR-900MWe to 3.4% for large N4 and GEN-III PWRs. In the peripheral assemblies which can host the power peak, the uncertainty increases from 1.1% for 900MWe to 2% for large PWRs. Therefore, the potential power swing bias in JEFF3.1.1 core calculations varies from 2.6% for PWR-900MWe to 5-6% for N4 and large GEN-III PWRs. Using BOLNA covariance files, the uncertainty on the Pcentre/Pperiph power ratio amounts to 10% (5% with COMAC) for GEN-III PWR core, and up to 24% in the Gen-III MOX benchmark (12% with COMAC). Our powerful deterministic calculation scheme allowed the decomposition of the LWR parameter uncertainty in isotopic partial cross-section components. The main contributor to the power uncertainty is the 238U inelastic scattering: 3% and 5%, respectively for COMAC and BOLNA, in GEN-III central assemblies. However, 16O and 1H elastic scattering cross-sections should be also validated and improved in order to reduce their individual 1%-2% current contribution to the central power uncertainty. ? Proceedings of the International Conference on Physics of Reactors, PHYSOR 2014. All right reserved.",Power map; PWR large core; Sensitivity; Uncertainty propagation
"Avramova M.N., Ivanov K.N., Royer E., Yamaji A., Gilford J.",Summary and Status of Oecd/Nea Uam-Lwr Benchmark,2014,https://www.scopus.com/inward/record.uri?eid=2-s2.0-85105305866&partnerID=40&md5=a3eb6e8ad16bd9fa7d43643eb3ddd273,"In recent years there has been an increasing demand from nuclear research, industry, safety and regulation for best estimate predictions to be provided with their confidence bounds. Consequently OECD/NEA has initiated an international Uncertainty Analysis in Modeling (UAM) benchmark focused on uncertainty analysis in best-estimate coupled code calculations for design, operation, and safety analysis of LWRs. The title of this benchmark is: ""Benchmarks for uncertainty analysis in modelling (UAM) for the design, operation and safety analysis of LWRs"", or often referred to as ""OECD/NEA UAM-LWR Benchmark"". Reference systems and scenarios for coupled code analysis are defined to study the uncertainty effects for all stages of the system calculations. Measured data from plant operation are available for the chosen scenarios. The general frame of the OECD/NEA UAM LWR benchmark consists of three phases with different exercises for each phase. This paper summarizes the benchmark activity and discusses the status of each phase and exercise. Selected results are shown to illustrate the technical approach in defining different exercises and findings from benchmark analysis. For the first time this benchmarks aims to determine the uncertainty in LWR system calculations at all stages of a coupled reactor physics/thermal-hydraulics/fuel performance calculation. The full chain of uncertainty propagation from basic data, engineering uncertainties, across different scales (multi-scale), and physics phenomena (multi-physics) are tested on a number of benchmark exercises for which experimental data are available and for which the power plant details have been released. As part of this effort, the development and assessment of different methods or techniques to account for the uncertainties in the calculations are investigated and reported, which contributes to the state-of-The-Art in this area. ? Proceedings of the International Conference on Physics of Reactors, PHYSOR 2014. All right reserved.",benchmark exercises; best-estimate coupled computation; Uncertainty analysis
Pusa M.,Adjoint-based sensitivity and uncertainty analysis of lattice physics calculations with casmo-4,2014,https://www.scopus.com/inward/record.uri?eid=2-s2.0-85104539032&partnerID=40&md5=d32518bd5a48dff6d9fb228c9902272a,"The topic of this paper is the development of sensitivity and uncertainty analysis capabil-ity to the reactor physics code CASMO-4 in the UAM (Uncertainty Analysis in Best-Estimate Modelling for Design, Operation and Safety Analysis of LWRs) benchmark. The developed cal-culation system enables the uncertainty analysis of homogenized multi-group cross-sections, diffusion coefficients and pin powers with respect to nuclear data. The uncertainty analysis methodology is deterministic, meaning that the sensitivity profiles of the responses are com-puted first, after which uncertainty is propagated by combining the sensitivity profiles with the covariance matrices of the uncertain nuclear data. The sensitivity analysis is based on per-turbation theory which enables computing the sensitivity profiles efficiently by solving one generalized adjoint system for each response. The mathematical background of this work is reviewed and the main conclusions related to the implementation are summarized. Special emphasis is placed on the sensitivity analysis of two-group homogenized diffusion coefficients which require some modifications to the standard equations of generalized perturbation theory. Numerical results are presented and analyzed for a PWR fuel assembly with control rods out and inserted. The computational efficiency of the calculations is discussed. ? 2014 Westinghouse Electric Company LLC. All Rights Reserved.",Perturbation theory; Sensitivity analysis; UAM; Uncertainty analysis
"Cabellos O., Piedra D., Diez C.J., Fiorito L.",Impact of the fission yield nuclear data uncertainties in the pin-cell burn-up oecd/nea uam benchmark,2014,https://www.scopus.com/inward/record.uri?eid=2-s2.0-85098693300&partnerID=40&md5=e12ed28ac6c96ded621b0ee8a6b30d55,"The prediction of fission products and the impact of their uncertainties to different safety-related spent fuel applications (burn-up credit, decay heat generation, radiological safety, waste management, burn-up prediction) are required for the evaluation of spent fuel system designs and safety analysis options. One of the nuclear data needs to this prediction is the independent fission yields. The mostly used general-purpose evaluated nuclear data libraries provide these data including their uncertainties as standard deviation, with no-correlation between fission yields. However, new developments in the theory and measurements of fission product yields are expected to result in new evaluated files in the next coming years. These files will include considerably more accurate yields including neutron energy dependence combined with new covariance information allowing realistic uncertainty estimates. In this paper, we focused on the effect of fission yield covariance information on criticality and depletion calculations. A LWR pin-cell burn-up benchmark, proposed in the general framework of the OECD/UAM Benchmark is analyzed to address the impact of independent fission yield uncertainties. Calculations were performed with the SCALE6 system and the ENDF/B-VII.1 fission yield data library, adding covariance data obtained from including covariance info of mass yields. Results are compared with those obtained with the uncertainty data currently provided by ENDF/B-VII.1. The uncertainty quantification is performed with a Monte Carlo sampling and then compared with linear perturbation. ? 2014 Westinghouse Electric Company LLC. All Rights Reserved.",burn-up credit; covariance; fission yield; sensitivity/uncertainty analysis
"Garc?a H.J., G?mez-Bernal A., P?rez E.P., Garc?a A.G.",A masonry evolution story: Unreinforced adobe into confined masonry structures in countries with high seismic activity,2014,https://www.scopus.com/inward/record.uri?eid=2-s2.0-84994429972&partnerID=40&md5=87fd392dc683075964f3ae6ba59e7639,"On Tuesday, March 20th, 2012, at 12:02 local time (18:02 GMT), an earthquake with magnitude Mw = 7.4, struck the area of Oaxaca and Guerrero States in the southeastern region of Mexico. Since 1928, and approximately every 14 years, earthquake events have happened in this area known as the Ometepec Segment in the Mexican subduction zone.Structural damage is strongly related to economic situation. The lack of expert advice, on how to improve structural configuration utilizing local available materials and minimizing costs, left several damaged houses with highly inadequate retrofits. However, we could observe in damage recognition in recent earthquakes that the construction practice has improved, despite local and state seismic provisions; the affected population has learned the lessons of having houses with poor adobe blocks, or poor structural configurations. Seismic vulnerability studies conducted in El Salvador, in Central America, have also demonstrated that this seismic evolution is a current activity in countries with high seismic activity. The objective of the reconnaissance team of the Structures Area, of the Universidad Autonoma Metropolitana (UAM-A), has always been to recognize the cause of damage to structures, in the epicentral areas that happened in Mexico; as well as let the structural engineering community know about the lessons learned from these earthquakes. In this paper we discuss that in rural communities is less frequent the use of Adobe Structures, they have improved the construction practice by replacing adobe with confined masonry structures, and hence improving their seismic behaviour. We also discuss how the seismic vulnerability in these areas has been reduced through years and earthquakes.",Masonry; Seimic vulnerability assessment; UAM-A Reconaissance team
"Ivanov E., Ivanova T., Kodeli I.-A., Mastrangelo V.",Data Assimilation for Kinetic Parameters Uncertainty Analysis,2014,https://www.scopus.com/inward/record.uri?eid=2-s2.0-84992145232&partnerID=40&md5=81d326d34ead52b118f29f5252e7b611,"Several years ago, the OECD/NEA Nuclear Science Committee (NSC) established the Expert Group on Uncertainty Analysis in Modeling (UAM-LWR) after thorough discussions of the demands from nuclear research, industry, safety and regulation to provide the best estimate predictions of nuclear systems parameters with their confidence bounds. UAM objectives include among others, the quantification of uncertainties of neutronic calculations with respect to their value for the multi-physics analysis. Since the kinetics parameters and their uncertainties are of particular interest for these studies the deterministic approaches for analysis of uncertainties in nuclear reactor kinetic parameters (neutron generation lifetime and delayed neutron effective fraction) have been developed in frame of the UAM-LWR. The approach uses combination of generalization of perturbation theory to reactivity analysis, and the Generalized Perturbation Theory (GPT) for sensitivity computation. It has been applied to the UAM complementary fast neutron SNEAK test case that has unique set of experimental data for ¥âeff. In this example, the covariance matrices of nuclear data have been derived from COMMARA library by Bayesian adjustment upon the set of the fast neutron integral benchmarks with the BERING code package. Then, the kinetic parameters uncertainties with their correlations have been applied to simplified model of a reactivity insertion transient where relative uncertainty of power peak was taken as figure of merit. The results demonstrate that the uncertainties due to nuclear data impact significantly the energy release in a coupled transient modeling. It was also found that such uncertainties become higher if the correlations between uncertainties of different lumped parameters are taken into account. ? 2014 Westinghouse Electric Company LLC. All Rights Reserved.",Generalized Linear Least Square Approach and transient analysis.; kinetic parameters; perturbation theory; Uncertainty Analysis in Modeling (UAM)
